{
  "id": "SVC-PENTEST-MOB",
  "name": "Mobile Application Security Assessment",
  "description": "Security evaluation of mobile applications on Android and iOS platforms covering transport security, local data storage, authentication mechanisms, binary protections, and platform-specific vulnerabilities.",
  "scope_reference": "Security assessment of mobile applications (Android, iOS)",
  "required_competencies": [
    { "skill": "SWSEC-MOB-TIC", "minimum_level": 3 },
    { "skill": "SWSEC-MOB-ANDROID", "minimum_level": 3 },
    { "skill": "SWSEC-MOB-IOS", "minimum_level": 3 },
    { "skill": "SWSEC-WEB-API", "minimum_level": 2 },
    { "skill": "SWSEC-RE-DECOMPILE", "minimum_level": 2 },
    { "skill": "FOUND-REPORT", "minimum_level": 3 },
    { "skill": "FOUND-RISK", "minimum_level": 3 }
  ],
  "standards": [
    "OWASP Mobile Application Security Verification Standard (MASVS) v2.1",
    "OWASP Mobile Application Security Testing Guide (MASTG) v2"
  ]
}
