{
  "id": "SVC-REDTEAM",
  "name": "Red Team Engagement",
  "description": "Goal-oriented adversarial simulation that emulates real-world threat actors across the full attack lifecycle, testing detection and response capabilities through coordinated multi-vector campaigns including network, application, social engineering, and physical attack paths.",
  "scope_reference": "Adversarial simulation and red team operations",
  "required_competencies": [
    { "skill": "ADVSIM-RED-PLANNING", "minimum_level": 3 },
    { "skill": "ADVSIM-RED-C2", "minimum_level": 3 },
    { "skill": "ADVSIM-RED-EVASION", "minimum_level": 3 },
    { "skill": "ADVSIM-RED-EXECUTION", "minimum_level": 3 },
    { "skill": "ADVSIM-RED-DEBRIEF", "minimum_level": 3 },
    { "skill": "NETSEC-RECON-PASSIVERECON", "minimum_level": 3 },
    { "skill": "NETSEC-RECON-PORTSCANNING", "minimum_level": 3 },
    { "skill": "NETSEC-RECON-NETMAPPING", "minimum_level": 2 },
    { "skill": "NETSEC-RECON-FINGERPRINTING", "minimum_level": 2 },
    { "skill": "NETSEC-ENUM-DNS", "minimum_level": 2 },
    { "skill": "NETSEC-ENUM-SMB", "minimum_level": 2 },
    { "skill": "NETSEC-ENUM-LDAP", "minimum_level": 2 },
    { "skill": "NETSEC-EXPLOIT-SVCEXPLOIT", "minimum_level": 3 },
    { "skill": "NETSEC-EXPLOIT-AUTHN", "minimum_level": 3 },
    { "skill": "NETSEC-POST-PRIVESC", "minimum_level": 3 },
    { "skill": "NETSEC-POST-PERSISTENCE", "minimum_level": 3 },
    { "skill": "NETSEC-POST-EXFIL", "minimum_level": 3 },
    { "skill": "NETSEC-POST-CREDHARVEST", "minimum_level": 3 },
    { "skill": "NETSEC-PIVOT-PORTFWD", "minimum_level": 3 },
    { "skill": "NETSEC-PIVOT-PROXYCHAINS", "minimum_level": 2 },
    { "skill": "SWSEC-OS-WINPRIV", "minimum_level": 3 },
    { "skill": "SWSEC-OS-LINPRIV", "minimum_level": 3 },
    { "skill": "SWSEC-OS-KERNEL", "minimum_level": 2 },
    { "skill": "SWSEC-OS-WINEVADE", "minimum_level": 2 },
    { "skill": "INFRA-ONPREM-AD", "minimum_level": 3 },
    { "skill": "INFRA-AZURE-ENTRAID", "minimum_level": 2 },
    { "skill": "ADVSIM-SE-PRETEXT", "minimum_level": 3 },
    { "skill": "ADVSIM-SE-PHISHING", "minimum_level": 3 },
    { "skill": "ADVSIM-SE-VISHING", "minimum_level": 2 },
    { "skill": "ADVSIM-PHYS-ACCESS", "minimum_level": 2 },
    { "skill": "INTEL-TI-TTP", "minimum_level": 2 },
    { "skill": "INTEL-OSINT-PERSON", "minimum_level": 3 },
    { "skill": "INTEL-OSINT-SOCIAL", "minimum_level": 2 },
    { "skill": "INTEL-OSINT-INFRA", "minimum_level": 3 },
    { "skill": "INTEL-OSINT-BREACH", "minimum_level": 2 },
    { "skill": "FOUND-REPORT", "minimum_level": 3 },
    { "skill": "FOUND-ETHICS", "minimum_level": 3 },
    { "skill": "FOUND-PM", "minimum_level": 3 }
  ],
  "standards": [
    "CBEST Threat Intelligence-Led Penetration Testing",
    "TIBER-EU Framework (2025 edition, aligned with DORA TLPT)",
    "DORA TLPT RTS (Commission Delegated Regulation (EU) 2025/1190)",
    "MITRE ATT&CK Framework"
  ]
}
