{
  "id": "SVC-FIPS-EVAL",
  "name": "FIPS 140-3 Evaluation",
  "description": "Evaluation of cryptographic modules against FIPS 140-3 requirements including module boundary definition, algorithm validation, physical security assessment, and CMVP submission process management.",
  "scope_reference": "FIPS 140-3 evaluation of cryptographic modules",
  "required_competencies": [
    { "skill": "HWSEC-CRYPTO-ACCEL", "minimum_level": 2 },
    { "skill": "HWSEC-CRYPTO-RNG", "minimum_level": 3 },
    { "skill": "HWSEC-CRYPTO-HSM", "minimum_level": 2 },
    { "skill": "HWSEC-CRYPTO-KEY", "minimum_level": 3 },
    { "skill": "CRYPTO-SYM-BLOCKCIPHER", "minimum_level": 3 },
    { "skill": "CRYPTO-SYM-AEAD", "minimum_level": 2 },
    { "skill": "CRYPTO-ASYM-RSA", "minimum_level": 3 },
    { "skill": "CRYPTO-ASYM-ECC", "minimum_level": 2 },
    { "skill": "CRYPTO-HASH-ASSESSMENT", "minimum_level": 3 },
    { "skill": "CRYPTO-HASH-MAC", "minimum_level": 2 },
    { "skill": "FOUND-REPORT", "minimum_level": 3 },
    { "skill": "FOUND-EVIDENCE", "minimum_level": 3 },
    { "skill": "FOUND-STANDARDS", "minimum_level": 3 }
  ],
  "standards": [
    "FIPS 140-3",
    "ISO/IEC 19790:2012 and ISO/IEC 24759:2017 (as referenced by FIPS 140-3; 2025 editions published)",
    "NIST SP 800-140 series (CMVP modifications to ISO/IEC 24759 and 19790 annexes)",
    "CMVP (Cryptographic Module Validation Program)"
  ]
}
