{
  "id": "SVC-PENTEST-INFRA",
  "name": "Infrastructure Security Assessment",
  "description": "Assessment of cloud and on-premises infrastructure configurations against security best practices, covering identity management, network controls, storage security, compute hardening, and infrastructure-as-code review.",
  "scope_reference": "Security assessment of cloud and on-premises infrastructure",
  "required_competencies": [
    { "skill": "INFRA-AWS-IAM", "minimum_level": 3 },
    { "skill": "INFRA-AWS-S3", "minimum_level": 3 },
    { "skill": "INFRA-AWS-VPC", "minimum_level": 3 },
    { "skill": "INFRA-AWS-LAMBDA", "minimum_level": 2 },
    { "skill": "INFRA-AZURE-ENTRAID", "minimum_level": 3 },
    { "skill": "INFRA-AZURE-STORAGE", "minimum_level": 2 },
    { "skill": "INFRA-AZURE-NETWORK", "minimum_level": 2 },
    { "skill": "INFRA-AZURE-FUNC", "minimum_level": 2 },
    { "skill": "INFRA-GCP-IAM", "minimum_level": 2 },
    { "skill": "INFRA-GCP-GCS", "minimum_level": 2 },
    { "skill": "INFRA-GCP-VPC", "minimum_level": 2 },
    { "skill": "INFRA-CONTAINER-IMAGE", "minimum_level": 3 },
    { "skill": "INFRA-CONTAINER-RUNTIME", "minimum_level": 3 },
    { "skill": "INFRA-CONTAINER-K8S", "minimum_level": 3 },
    { "skill": "INFRA-CONTAINER-DOCKER", "minimum_level": 3 },
    { "skill": "INFRA-IAC-TERRAFORM", "minimum_level": 2 },
    { "skill": "INFRA-IAC-CFN", "minimum_level": 2 },
    { "skill": "INFRA-IAC-POLICY", "minimum_level": 2 },
    { "skill": "INFRA-IAC-ANSIBLE", "minimum_level": 2 },
    { "skill": "INFRA-ONPREM-VIRT", "minimum_level": 2 },
    { "skill": "INFRA-ONPREM-HARDEN", "minimum_level": 3 },
    { "skill": "INFRA-ONPREM-BACKUP", "minimum_level": 2 },
    { "skill": "INFRA-ONPREM-AD", "minimum_level": 3 },
    { "skill": "NETSEC-INFRA-FIREWALL", "minimum_level": 3 },
    { "skill": "NETSEC-INFRA-ROUTERSWITCH", "minimum_level": 2 },
    { "skill": "NETSEC-INFRA-SEGMENTATION", "minimum_level": 3 },
    { "skill": "ICSIOT-ICS-NETWORK", "minimum_level": 2 },
    { "skill": "FOUND-REPORT", "minimum_level": 3 },
    { "skill": "FOUND-RISK", "minimum_level": 3 }
  ],
  "standards": [
    "CIS Benchmarks",
    "CSA Cloud Controls Matrix (CCM)"
  ]
}
