{
  "id": "SVC-PENTEST-WEB",
  "name": "Web Application Penetration Test",
  "description": "Comprehensive security assessment of web applications including injection flaws, authentication and authorization defects, API vulnerabilities, and business logic issues through manual and automated testing techniques.",
  "scope_reference": "Penetration testing of web applications and APIs",
  "required_competencies": [
    { "skill": "SWSEC-WEB-XSS", "minimum_level": 3 },
    { "skill": "SWSEC-WEB-SQLI", "minimum_level": 3 },
    { "skill": "SWSEC-WEB-AUTHZ", "minimum_level": 3 },
    { "skill": "SWSEC-WEB-API", "minimum_level": 3 },
    { "skill": "SWSEC-WEB-INJECT", "minimum_level": 3 },
    { "skill": "SWSEC-WEB-HTTPCONF", "minimum_level": 3 },
    { "skill": "SWSEC-WEB-DESER", "minimum_level": 2 },
    { "skill": "SWSEC-DAST-WEBAPP", "minimum_level": 3 },
    { "skill": "SWSEC-DAST-WEBFUZZ", "minimum_level": 2 },
    { "skill": "FOUND-REPORT", "minimum_level": 3 },
    { "skill": "FOUND-RISK", "minimum_level": 3 },
    { "skill": "FOUND-ETHICS", "minimum_level": 3 }
  ],
  "standards": [
    "OWASP Web Security Testing Guide (WSTG) v4.2",
    "OWASP Application Security Verification Standard (ASVS) 5.0",
    "CREST Web Application Testing Guide"
  ]
}
