{
  "id": "SVC-MALWARE",
  "name": "Malware Analysis",
  "description": "Analysis of malicious software through static, dynamic, and behavioral techniques to determine capabilities, communication channels, persistence mechanisms, and attribution indicators, with optional reverse engineering for in-depth understanding.",
  "scope_reference": "Analysis and characterization of malicious software",
  "required_competencies": [
    { "skill": "DFIR-MAL-STATIC", "minimum_level": 3 },
    { "skill": "DFIR-MAL-DYNAMIC", "minimum_level": 3 },
    { "skill": "DFIR-MAL-RE", "minimum_level": 3 },
    { "skill": "DFIR-MAL-C2", "minimum_level": 3 },
    { "skill": "SWSEC-RE-DISASM", "minimum_level": 3 },
    { "skill": "SWSEC-RE-DECOMPILE", "minimum_level": 3 },
    { "skill": "SWSEC-RE-ANTIRE", "minimum_level": 2 },
    { "skill": "SWSEC-RE-PROTOCOL", "minimum_level": 2 },
    { "skill": "FOUND-REPORT", "minimum_level": 3 }
  ],
  "standards": [
    "Internal malware analysis methodology"
  ]
}
